[
  {
    "id": "10101010-1010-4101-8101-101010101010",
    "siteId": "11111111-1111-4111-8111-111111111111",
    "lotId": "66666666-6666-4666-8666-666666666666",
    "code": "SL-2026-001-A",
    "kind": "sous_lot",
    "volumeLiters": 2500,
    "storageLocation": "C-01",
    "status": "active",
    "createdAt": "2026-05-18T09:00:00.000Z",
    "updatedAt": "2026-05-18T09:00:00.000Z"
  },
  {
    "id": "11101010-1010-4101-8101-101010101010",
    "siteId": "11111111-1111-4111-8111-111111111111",
    "lotId": "66666666-6666-4666-8666-666666666666",
    "code": "ECH-C01-0518",
    "kind": "echantillon",
    "parentSubLotId": "10101010-1010-4101-8101-101010101010",
    "sampleSizeMl": 250,
    "storageLocation": "Laboratoire",
    "status": "active",
    "createdAt": "2026-05-18T09:00:00.000Z",
    "updatedAt": "2026-05-18T09:00:00.000Z"
  }
]

