[
  {
    "id": "d0000001-0000-4000-8000-000000000001",
    "siteId": "11111111-1111-4111-8111-111111111111",
    "lotId": "60000001-0000-4000-8000-000000000001",
    "code": "LOT-2026-001-SL1",
    "kind": "sous_lot",
    "volumeLiters": 1000,
    "status": "active",
    "createdAt": "2026-05-18T09:00:00.000Z",
    "updatedAt": "2026-05-18T09:00:00.000Z"
  },
  {
    "id": "d0000002-0000-4000-8000-000000000002",
    "siteId": "11111111-1111-4111-8111-111111111111",
    "lotId": "60000002-0000-4000-8000-000000000002",
    "code": "LOT-2026-002-SL1",
    "kind": "sous_lot",
    "volumeLiters": 1000,
    "status": "active",
    "createdAt": "2026-05-18T09:00:00.000Z",
    "updatedAt": "2026-05-18T09:00:00.000Z"
  },
  {
    "id": "d0000003-0000-4000-8000-000000000003",
    "siteId": "11111111-1111-4111-8111-111111111111",
    "lotId": "60000003-0000-4000-8000-000000000003",
    "code": "LOT-2026-003-SL1",
    "kind": "sous_lot",
    "volumeLiters": 1000,
    "status": "active",
    "createdAt": "2026-05-18T09:00:00.000Z",
    "updatedAt": "2026-05-18T09:00:00.000Z"
  },
  {
    "id": "d0000004-0000-4000-8000-000000000004",
    "siteId": "11111111-1111-4111-8111-111111111111",
    "lotId": "60000004-0000-4000-8000-000000000004",
    "code": "LOT-2026-004-SL1",
    "kind": "sous_lot",
    "volumeLiters": 1000,
    "status": "active",
    "createdAt": "2026-05-18T09:00:00.000Z",
    "updatedAt": "2026-05-18T09:00:00.000Z"
  },
  {
    "id": "d0000005-0000-4000-8000-000000000005",
    "siteId": "11111111-1111-4111-8111-111111111111",
    "lotId": "60000005-0000-4000-8000-000000000005",
    "code": "LOT-2026-005-SL1",
    "kind": "sous_lot",
    "volumeLiters": 1000,
    "status": "active",
    "createdAt": "2026-05-18T09:00:00.000Z",
    "updatedAt": "2026-05-18T09:00:00.000Z"
  },
  {
    "id": "d0000006-0000-4000-8000-000000000006",
    "siteId": "11111111-1111-4111-8111-111111111111",
    "lotId": "60000006-0000-4000-8000-000000000006",
    "code": "LOT-2026-006-SL1",
    "kind": "sous_lot",
    "volumeLiters": 1000,
    "status": "active",
    "createdAt": "2026-05-18T09:00:00.000Z",
    "updatedAt": "2026-05-18T09:00:00.000Z"
  },
  {
    "id": "d0000007-0000-4000-8000-000000000007",
    "siteId": "11111111-1111-4111-8111-111111111111",
    "lotId": "60000007-0000-4000-8000-000000000007",
    "code": "LOT-2026-007-SL1",
    "kind": "sous_lot",
    "volumeLiters": 1000,
    "status": "active",
    "createdAt": "2026-05-18T09:00:00.000Z",
    "updatedAt": "2026-05-18T09:00:00.000Z"
  },
  {
    "id": "d0000008-0000-4000-8000-000000000008",
    "siteId": "11111111-1111-4111-8111-111111111111",
    "lotId": "60000008-0000-4000-8000-000000000008",
    "code": "LOT-2026-008-SL1",
    "kind": "sous_lot",
    "volumeLiters": 1000,
    "status": "active",
    "createdAt": "2026-05-18T09:00:00.000Z",
    "updatedAt": "2026-05-18T09:00:00.000Z"
  },
  {
    "id": "d0000009-0000-4000-8000-000000000009",
    "siteId": "22222222-2222-4222-8222-222222222222",
    "lotId": "60000009-0000-4000-8000-000000000009",
    "code": "LOT-2026-009-SL1",
    "kind": "sous_lot",
    "volumeLiters": 1000,
    "status": "active",
    "createdAt": "2026-05-18T09:00:00.000Z",
    "updatedAt": "2026-05-18T09:00:00.000Z"
  },
  {
    "id": "d0000010-0000-4000-8000-000000000010",
    "siteId": "22222222-2222-4222-8222-222222222222",
    "lotId": "60000010-0000-4000-8000-000000000010",
    "code": "LOT-2026-010-SL1",
    "kind": "sous_lot",
    "volumeLiters": 1000,
    "status": "active",
    "createdAt": "2026-05-18T09:00:00.000Z",
    "updatedAt": "2026-05-18T09:00:00.000Z"
  }
]
